objectid,type,name,managedby,island,gis_acre,type_defin,linktowebp,linktoadmi,linktoad_1,linktoad_2,linktoad_3,xname,tlabel,uid,st_areashape,st_perimetershape
236,gma,KAONOULU RANCH COOPERATIVE GAME MANAGEMENT AREA,DOFAW,Maui,975.54825972,Game Management Area,https://dlnr.hawaii.gov/recreation/hunting/gma/kaonoulu-ranch/,https://dlnr.hawaii.gov/dofaw/files/2013/09/HAR-122-Game-Birds.pdf,https://dlnr.hawaii.gov/dofaw/files/2013/09/HAR-123-Game-Mammals.pdf, , ,Kaonoulu Ranch Cooperative Game Management Area,Ka‘ono‘ulu Ranch Cooperative Game Management Area,MA_GMA_02,3947903.74021261,15173.4768878682
237,fr,WAIAHOLE FOREST RESERVE,DOFAW,Oahu,71.70191613,Forest Reserve,https://dlnr.hawaii.gov/forestry/frs/reserves/oahu/,https://dlnr.hawaii.gov/dofaw/files/2013/09/HARChapter13-104.pdf, , , ,Waiahole Forest Reserve,Waiāhole Forest Reserve,OA_FR_17,290167.359770835,3152.42035246321
238,fr,KANEOHE FOREST RESERVE,DOFAW,Oahu,19.64384567,Forest Reserve,https://dlnr.hawaii.gov/forestry/frs/reserves/oahu/,https://dlnr.hawaii.gov/dofaw/files/2013/09/HARChapter13-104.pdf, , , ,Kaneohe Forest Reserve,Kāne‘ohe Forest Reserve,OA_FR_08,79495.8230036007,1551.43830110975
239,ws,SAND ISLAND WILDLIFE SANCTUARY,DOFAW,Kure,4.18153185,Wildlife Sanctuary,https://dlnr.hawaii.gov/wildlife/sanctuaries/,https://files.hawaii.gov/dlnr/dofaw/rules/Chap125a.pdf,https://files.hawaii.gov/dlnr/dofaw/rules/Chap126.pdf, , ,Sand Island Wildlife Sanctuary,Sand Island Wildlife Sanctuary,KURE_WS_02,16922.0590398538,1801.21717162824
240,ws,GREEN ISLAND WILDLIFE SANCTUARY,DOFAW,Kure,235.94125007,Wildlife Sanctuary,https://dlnr.hawaii.gov/wildlife/sanctuaries/,https://files.hawaii.gov/dlnr/dofaw/rules/Chap125a.pdf,https://files.hawaii.gov/dlnr/dofaw/rules/Chap126.pdf, , ,Green Island Wildlife Sanctuary,Green Island Wildlife Sanctuary,KURE_WS_01,954820.363137049,5767.65524594191
241,xxx,KAHUKU MOTOCROSS PARK,US Army/DOFAW,Oahu,449.74731121,Other Units Managed by DOFAW, , , , , ,Kahuku Motocross Park,Kahuku Motocross Park,OA_XXX_18,1820062.79481989,6691.94887420224
242,ws,KAWAINUI MARSH WILDLIFE SANCTUARY,DOFAW,Oahu,796.57774773,Wildlife Sanctuary,https://dlnr.hawaii.gov/wildlife/sanctuaries/kawainui/,https://files.hawaii.gov/dlnr/dofaw/rules/Chap125a.pdf,https://files.hawaii.gov/dlnr/dofaw/rules/Chap126.pdf, , ,Kawainui Marsh Wildlife Sanctuary,Kawainui Marsh Wildlife Sanctuary,OA_WS_05,3223635.77433678,10630.7558737204
243,shp,ULUPO HEIAU STATE HISTORICAL PARK,DOSP,Oahu,28.67074263,State Historical Park, , , , , ,Ulupo Heiau State Historical Park,Ulupō Heiau State Historical Park,OA_SHP_01,116026.378963534,3216.90627716942
244,ws,KANAHA POND WILDLIFE SANCTUARY (MAUONI SECTION),DOFAW,Maui,7.80751242,Wildlife Sanctuary,https://dlnr.hawaii.gov/wildlife/sanctuaries/kanaha/,https://files.hawaii.gov/dlnr/dofaw/rules/Chap125a.pdf,https://files.hawaii.gov/dlnr/dofaw/rules/Chap126.pdf, , ,Kanaha Pond Wildlife Sanctuary (Mauoni Section),Kanahā Pond Wildlife Sanctuary (Mauoni Section),MA_WS_04,31595.8817631674,741.697045494306
245,fr,MANA PLAINS FOREST RESERVE,DOFAW,Kauai,139.15276002,Forest Reserve,https://dlnr.hawaii.gov/forestry/frs/reserves/kauai/mana-plains/,https://dlnr.hawaii.gov/dofaw/files/2013/09/HARChapter13-104.pdf, , , ,Mana Plains Forest Reserve,Mānā Plains Forest Reserve,KA_FR_05,563131.240597335,5715.64402702744
246,fr,EWA FOREST RESERVE (KALAUAO SEC),DOFAW,Oahu,645.96281236,Forest Reserve,https://dlnr.hawaii.gov/forestry/frs/reserves/oahu/,https://dlnr.hawaii.gov/dofaw/files/2013/09/HARChapter13-104.pdf, , , ,Ewa Forest Reserve (Kalauao Sec),‘Ewa Forest Reserve (Kalauao Sec.),OA_FR_01,2614118.75583462,16231.8860575573
247,ws,POUHALA MARSH WILDLIFE SANCTUARY,DOFAW,Oahu,72.20697865,Wildlife Sanctuary,https://dlnr.hawaii.gov/wildlife/sanctuaries/pouhala/,https://files.hawaii.gov/dlnr/dofaw/rules/Chap125a.pdf,https://files.hawaii.gov/dlnr/dofaw/rules/Chap126.pdf, , ,Pouhala Marsh Wildlife Sanctuary,Pouhala Marsh Wildlife Sanctuary,OA_WS_16,292211.275271494,2636.20001019559
248,fr,NA PALI-KONA FOREST RESERVE,DOFAW,Kauai,4132.07466403,Forest Reserve,https://dlnr.hawaii.gov/forestry/frs/reserves/kauai/na-pali-kona/,https://dlnr.hawaii.gov/dofaw/files/2013/09/HARChapter13-104.pdf, , , ,Na Pali-Kona Forest Reserve,Nā Pali-Kona Forest Reserve,KA_FR_07,16721912.8919697,39923.6892693621
249,fr-p,NA PALI-KONA FR/ALAKAI WILDERNESS PRESERVE,DOFAW,Kauai,9939.7404421,Forest Reserve/Preserve,http://dlnr.hawaii.gov/forestry/frs/reserves/kauai/na-pali-kona/,https://dlnr.hawaii.gov/dofaw/files/2013/09/HARChapter13-104.pdf,https://files.hawaii.gov/dlnr/dofaw/rules/Chap3.pdf, , ,Na Pali-Kona Fr/Alakai Wilderness Preserve,Nā Pali-Kona Forest Reserve / Alaka‘i Wilderness Preserve,KA_FR-P_01,40224702.4451167,34510.5123039504
250,fr,PUU KA PELE FOREST RESERVE,DOFAW,Kauai,13972.8895139,Forest Reserve,https://dlnr.hawaii.gov/forestry/frs/reserves/kauai/puu-ka-pele/,https://dlnr.hawaii.gov/dofaw/files/2013/09/HARChapter13-104.pdf, , , ,Puu Ka Pele Forest Reserve,Pu‘u Ka Pele Forest Reserve,KA_FR_09,56546277.6687703,59265.3419469502
251,fr,PUU KA PELE FOREST RESERVE,DOFAW,Kauai,9405.93209309,Forest Reserve,https://dlnr.hawaii.gov/forestry/frs/reserves/kauai/puu-ka-pele/,https://dlnr.hawaii.gov/dofaw/files/2013/09/HARChapter13-104.pdf, , , ,Puu Ka Pele Forest Reserve,Pu‘u Ka Pele Forest Reserve,KA_FR_09,38064456.6995644,42081.9802802448
252,fr,NOUNOU FOREST RESERVE,DOFAW,Kauai,722.59732284,Forest Reserve,https://dlnr.hawaii.gov/forestry/frs/reserves/kauai/nounou-and-kalepa-forest-reserves/,https://dlnr.hawaii.gov/dofaw/files/2013/09/HARChapter13-104.pdf, , , ,Nounou Forest Reserve,Nounou Forest Reserve,KA_FR_08,2924247.61674887,9334.34525863542
253,fr,WAIAHOLE FOREST RESERVE,DOFAW,Oahu,67.16325284,Forest Reserve,https://dlnr.hawaii.gov/forestry/frs/reserves/oahu/,https://dlnr.hawaii.gov/dofaw/files/2013/09/HARChapter13-104.pdf, , , ,Waiahole Forest Reserve,Waiāhole Forest Reserve,OA_FR_17,271800.041110487,2613.73399221857
254,fr,WAIAHOLE FOREST RESERVE (IOLEKAA SEC),DOFAW,Oahu,199.94460229,Forest Reserve,https://dlnr.hawaii.gov/forestry/frs/reserves/oahu/,https://dlnr.hawaii.gov/dofaw/files/2013/09/HARChapter13-104.pdf,https://files.hawaii.gov/dlnr/dofaw/rules/Chap105.pdf, , ,Waiahole Forest Reserve (Iolekaa Sec),Waiāhole Forest Reserve (‘Ioleka‘a Sec.),OA_FR_18,809147.097882424,4293.04853538049
255,fr,WAIAHOLE FOREST RESERVE (WAIAHOLE SEC),DOFAW,Oahu,1236.77724246,Forest Reserve,https://dlnr.hawaii.gov/forestry/frs/reserves/oahu/,https://dlnr.hawaii.gov/dofaw/files/2013/09/HARChapter13-104.pdf, , , ,Waiahole Forest Reserve (Waiahole Sec),Waiāhole Forest Reserve (Waiāhole Sec.),OA_FR_19,5005059.92671503,12005.7298490125
256,fr,NANAKULI FOREST RESERVE,DOFAW,Oahu,600.37071338,Forest Reserve,https://dlnr.hawaii.gov/forestry/frs/reserves/oahu/,https://dlnr.hawaii.gov/dofaw/files/2013/09/HARChapter13-104.pdf, , , ,Nanakuli Forest Reserve,Nānākuli Forest Reserve,OA_FR_14,2429614.07726071,11748.3875412723
257,fr,MOKULEIA FOREST RESERVE,DOFAW,Oahu,2813.27620572,Forest Reserve,https://dlnr.hawaii.gov/forestry/frs/reserves/oahu/,https://dlnr.hawaii.gov/dofaw/files/2013/09/HARChapter13-104.pdf, , , ,Mokuleia Forest Reserve,Mokulē‘ia Forest Reserve,OA_FR_13,11384924.8811044,19964.175582814
258,fr,KAHIKINUI FOREST RESERVE,DOFAW,Maui,713.59315512,Forest Reserve,https://kahikinui-forest-reserve-histategis.hub.arcgis.com/,https://dlnr.hawaii.gov/dofaw/files/2013/09/HARChapter13-104.pdf, , , ,Kahikinui Forest Reserve,Kahikinui Forest Reserve (Papa‘anui Tract),MA_FR_03,2887809.04279515,14033.6476707574
259,fr,KULA FOREST RESERVE,DOFAW,Maui,3425.8060448,Forest Reserve,https://dlnr.hawaii.gov/forestry/frs/reserves/maui-nui/kula-forest-reserve/,https://dlnr.hawaii.gov/dofaw/files/2013/09/HARChapter13-104.pdf, , , ,Kula Forest Reserve,Kula Forest Reserve,MA_FR_09,13863745.1942955,36101.578035646
260,fr,KULA FOREST RESERVE,DOFAW,Maui,1500.895759,Forest Reserve,https://dlnr.hawaii.gov/forestry/frs/reserves/maui-nui/kula-forest-reserve/,https://dlnr.hawaii.gov/dofaw/files/2013/09/HARChapter13-104.pdf, , , ,Kula Forest Reserve,Kula Forest Reserve,MA_FR_09,6073909.64164415,11729.5075620642
261,gma,LANAI COOPERATIVE GAME MANAGEMENT AREA,DOFAW,Lanai,34162.5814433,Game Management Area,https://dlnr.hawaii.gov/recreation/hunting/gma/lanai/,https://files.hawaii.gov/dlnr/dofaw/rules/Chap125a.pdf,https://dlnr.hawaii.gov/dofaw/files/2013/09/HAR-122-Game-Birds.pdf,https://dlnr.hawaii.gov/dofaw/files/2013/09/HAR-123-Game-Mammals.pdf, ,Lanai Cooperative Game Management Area,Lāna‘i Cooperative Game Management Area,LA_GMA_01,138251062.119455,90396.7160043232
262,tnc,KIHOLO PRESERVE (NATURE CONSERVANCY),TNC,Hawaii,6.7717926,The Nature Conservancy Preserve, , , , , ,Kiholo Preserve (Nature Conservancy),Kīholo Preserve,HA_TNC_05,27404.4723544683,1008.39254949667
263,nhs,HONOULIULI NATIONAL HISTORIC SITE,USNPS,Oahu,155.08598338,National Historic Site, , , , , ,Honouliuli National Historic Site,Honouliuli National Historic Site,OA_NPS_01,627610.707861329,6852.59707361217
264,fr,ROUND TOP FOREST RESERVE,DOFAW,Oahu,98.68220713,Forest Reserve,https://dlnr.hawaii.gov/forestry/frs/reserves/oahu/,https://dlnr.hawaii.gov/dofaw/files/2013/09/HARChapter13-104.pdf, , , ,Round Top Forest Reserve,Round Top Forest Reserve,OA_FR_16,399352.723710948,7736.81131326433
265,fr,HONOLULU WATERSHED FOREST RESERVE,DOFAW,Oahu,10503.2868876,Forest Reserve,https://dlnr.hawaii.gov/forestry/frs/reserves/oahu/,https://dlnr.hawaii.gov/dofaw/files/2013/09/HARChapter13-104.pdf,https://files.hawaii.gov/dlnr/dofaw/rules/Chap105.pdf, , ,Honolulu Watershed Forest Reserve,Honolulu Watershed Forest Reserve,OA_FR_05,42505293.9973245,139512.431634995
266,fr-sm,WAIMANALO FR / MT OLOMANA STATE MONUMENT,DOFAW,Oahu,209.3697527,Forest Reserve/State Monument,https://dlnr.hawaii.gov/forestry/frs/reserves/oahu/,https://dlnr.hawaii.gov/dofaw/files/2013/09/HARChapter13-104.pdf, , , ,Waimanalo Fr / Mt Olomana State Monument,Waimānalo Forest Reserve / Mt Olomana State Monument,OA_FR-SM_01,847289.328366787,4340.32752140657
267,fr,NA PALI-KONA FOREST RESERVE,DOFAW,Kauai,8953.33292801,Forest Reserve,https://dlnr.hawaii.gov/forestry/frs/reserves/kauai/na-pali-kona/,https://dlnr.hawaii.gov/dofaw/files/2013/09/HARChapter13-104.pdf, , , ,Na Pali-Kona Forest Reserve,Nā Pali-Kona Forest Reserve,KA_FR_07,36232852.8615851,37303.7586587913
268,spr,KIHOLO STATE PARK RESERVE,DOSP,Hawaii,2.98949645,State Park Reserve, , , , , ,Kiholo State Park Reserve,Kīholo State Park Reserve,HA_SPR_09,12098.0628888483,490.63631713238
269,srp,WAIMEA STATE RECREATION PIER,DOSP,Kauai,1.2283571,State Recreation Pier, , , , , ,Waimea State Recreation Pier,Waimea State Recreation Pier,KA_SRP_02,4970.98483518873,329.357178892018
270,shs,PAULAULA STATE HISTORIC SITE,DOSP,Kauai,19.22189392,State Historic Site, , , , , ,Paulaula State Historic Site,Pā‘ula‘ula State Historic Site,KA_SHS_01,77788.2448759944,1209.20689937308
271,srp,AHUKINI STATE RECREATION PIER,DOSP,Kauai,2.77903323,State Recreation Pier, , , , , ,Ahukini State Recreation Pier,Ahukini State Recreation Pier,KA_SRP_01,11246.3484630584,858.838115018886
272,sp,WAILUA RIVER STATE PARK,DOSP,Kauai,1122.63498412,State Park, , , , , ,Wailua River State Park,Wailua River State Park,KA_SP_04,4543142.59550385,36039.9535191376
273,sss,KAIWI SCENIC SHORELINE,DOSP,Oahu,363.95750529,State Scenic Shoreline, , , , , ,Kaiwi Scenic Shoreline,Kaiwi Scenic Shoreline,OA_SSS_01,1472883.76778016,7669.64053837351
274,sxp,HANAUMA BAY STATE UNDERWATER PARK,DOSP,Oahu,96.39763157,State Park - Other, , , , , ,Hanauma Bay State Underwater Park,Hanauma Bay State Underwater Park,OA_SXP_01,390107.374441207,2967.84145406855
275,sp,PUU UALAKAA STATE WAYSIDE,DOSP,Oahu,82.15743251,State Park, , , , , ,Puu Ualakaa State Wayside,Pu‘u ‘Ualaka‘a State Wayside,OA_SW_03,332479.333390917,2788.13805607451
276,sp-p,QUEEN EMMA SUMMER PALACE,Daughters of Hawaii/DOSP,Oahu,8.2382195,State Park - Other, , , , , ,Queen Emma Summer Palace,Queen Emma Summer Palace,OA_SXP_02,33338.8915001429,799.953694351169
277,sra,SAND ISLAND STATE RECREATION AREA,DOSP,Oahu,133.42672779,State Recreation Area, , , , , ,Sand Island State Recreation Area,Sand Island State Recreation Area,OA_SRA_06,539958.810265511,6540.39730216625
278,sw,NUUANU PALI STATE WAYSIDE,DOSP,Oahu,3.96787193,State Wayside, , , , , ,Nuuanu Pali State Wayside,Nu‘uanu Pali State Wayside,OA_SW_02,16057.4080232252,734.477770756402
279,sra,KEAIWA HEIAU STATE RECREATION AREA,DOSP,Oahu,384.9030139,State Recreation Area, , , , , ,Keaiwa Heiau State Recreation Area,Keaīwa Heiau State Recreation Area,OA_SRA_02,1557647.23380557,6772.04685249488
280,sp,HEEIA STATE PARK,DOSP,Oahu,17.55066947,State Park, , , , , ,Heeia State Park,He‘eia State Park,OA_SP_02,71025.039478197,2046.60137275913
281,sp,AHUPUAA O KAHANA STATE PARK,DOSP,Oahu,5218.46571125,State Park, , , , , ,Ahupuaa O Kahana State Park,Ahupua‘a ‘Ō Kahana State Park,OA_SP_01,21118381.4786328,28191.064387909
282,sw,LAIE POINT STATE WAYSIDE,DOSP,Oahu,1.41604914,State Wayside, , , , , ,Laie Point State Wayside,Lā‘ie Point State Wayside,OA_SW_01,5730.54756413457,496.525247698362
283,sp,KAENA POINT STATE PARK,DOSP,Oahu,1508.35929363,State Park, , , , , ,Kaena Point State Park,Ka‘ena Point State Park,OA_SP_03,6104113.49472872,39185.9081401781
284,sp,PALAAU STATE PARK,DOSP,Molokai,232.04765942,State Park, , , , , ,Palaau State Park,Pālā‘au State Park,MO_SP_01,939063.560843885,5434.37556005668
285,sm,IAO VALLEY STATE MONUMENT,DOSP,Maui,6.15368875,State Monument, , , , , ,Iao Valley State Monument,‘Īao Valley State Monument,MA_SM_01,24903.0948212584,917.909052886199
286,shs,HALEKII-PIHANA HEIAU STATE HISTORIC SITE,DOSP,Maui,9.70788242,State Historic Site, , , , , ,Halekii-Pihana Heiau State Historic Site,Haleki‘i-Pihana Heiau State Historic Site,MA_SHS_01,39286.4063102981,1221.95324087107
287,sp,MAKENA STATE PARK,DOSP,Maui,170.62132237,State Park, , , , , ,Makena State Park,Mākena State Park,MA_SP_01,690479.994220939,4161.03283490398
288,sra,POLIPOLI SPRING STATE RECREATION AREA,DOSP,Maui,7.97243083,State Recreation Area, , , , , ,Polipoli Spring State Recreation Area,Polipoli Spring State Recreation Area,MA_SRA_01,32263.2828871303,947.954115775662
289,sw,KAUMAHINA STATE WAYSIDE,DOSP,Maui,7.1228181,State Wayside, , , , , ,Kaumahina State Wayside,Kaumanahina State Wayside,MA_SW_01,28825.0221684442,746.73039235529
290,sw,WAILUA VALLEY STATE WAYSIDE,DOSP,Maui,1.25418297,State Wayside, , , , , ,Wailua Valley State Wayside,Wailua Valley State Wayside,MA_SW_03,5075.49842288437,470.940979187058
291,sw,PUAA KAA STATE WAYSIDE,DOSP,Maui,2.13587087,State Wayside, , , , , ,Puaa Kaa State Wayside,Pua‘a Ka‘a State Wayside,MA_SW_02,8643.56275165894,575.966210926842
292,sp,WAIANAPANAPA STATE PARK,DOSP,Maui,108.75793076,State Park, , , , , ,Waianapanapa State Park,Waianapanapa State Park,MA_SP_02,440127.730578827,6083.9652821219
293,sm,KOHALA HIST. SITES ST. MONUMENT (KUKUIPAHU HEIAU),DOSP,Hawaii,9.98522551,State Monument, , , , , ,Kohala Hist. Sites St. Monument (Kukuipahu Heiau),Kohala Historical Sites State Monument (Kukuipahu Heiau),HA_SM_01,40408.7739788976,813.863470615914
294,shp,LAPAKAHI STATE HISTORICAL PARK,DOSP,Hawaii,293.95911622,State Historical Park, , , , , ,Lapakahi State Historical Park,Lapakahi State Historical Park,HA_SHP_04,1189610.3374002,6376.54745412559
295,sra,HAPUNA BEACH STATE RECREATION AREA,DOSP,Hawaii,524.63236727,State Recreation Area, , , , , ,Hapuna Beach State Recreation Area,Hāpuna Beach State Recreation Area,HA_SRA_01,2123111.86488411,19459.1769189628
296,sp,KEKAHA KAI STATE PARK  (MANINIOWALI SEC.),DOSP,Hawaii,776.45615816,State Park, , , , , ,Kekaha Kai State Park  (Maniniowali Sec.),Kekaha Kai State Park (Manini‘ōwaili Section),HA_SP_06,3142206.59034575,11366.0630150392
297,sp,KEKAHA KAI STATE PARK (MAHAIULA SEC.),DOSP,Hawaii,864.13953159,State Park, , , , , ,Kekaha Kai State Park (Mahaiula Sec.),Kekaha Kai State Park (Mahai‘ula Section),HA_SP_07,3497048.61324665,9652.86423038337
298,shp,KEOLONAHIHI STATE HISTORICAL PARK-KEAKEALANIWAHINE,DOSP,Hawaii,17.12693863,State Historical Park, , , , , ,Keolonahihi State Historical Park-Keakealaniwahine,Keolonāhihi State Historical Park - Keākealaniwahine,HA_SHP_03,69310.2615982435,1271.27988503895
299,shp,KEALAKEKUA BAY STATE HISTORICAL PARK,DOSP,Hawaii,539.28423888,State Historical Park, , , , , ,Kealakekua Bay State Historical Park,Kealakekua Bay State Historical Park,HA_SHP_01,2182405.88559994,7708.58323004141
300,sra,MACKENZIE STATE RECREATION AREA,DOSP,Hawaii,13.87128363,State Recreation Area, , , , , ,Mackenzie State Recreation Area,Mackenzie State Recreation Area,HA_SRA_03,56135.093253016,1056.89633928758
301,sp,WAILUKU RIVER STATE PARK,DOSP,Hawaii,7.01455102,State Park, , , , , ,Wailuku River State Park,Wailuku River State park,HA_SP_08,28386.8808388002,856.962373231713
302,sp,WAILUKU RIVER STATE PARK,DOSP,Hawaii,3.44113314,State Park, , , , , ,Wailuku River State Park,Wailuku River State park,HA_SP_08,13925.7717353095,720.477176703654
303,sra,WAILOA RIVER STATE RECREATION AREA,DOSP,Hawaii,111.91191489,State Recreation Area, , , , , ,Wailoa River State Recreation Area,Wailoa River State Recreation Area,HA_SRA_04,452891.451506753,4620.82852220282
304,sp,AKAKA FALLS STATE PARK,DOSP,Hawaii,65.91476214,State Park, , , , , ,Akaka Falls State Park,‘Akaka Falls State Park,HA_SP_05,266747.578501849,3108.68164052778
305,sw,MANUKA STATE WAYSIDE,DOSP,Hawaii,13.72967229,State Wayside, , , , , ,Manuka State Wayside,Manukā State Wayside,HA_SW_01,55562.0124811719,980.647469467167
306,sp,POLIHALE STATE PARK,DOSP,Kauai,148.18582157,State Park, , , , , ,Polihale State Park,Polihale State Park,KA_SP_03,599686.74371848,6670.32466219496
307,sm,ROYAL MAUSOLEUM STATE MONUMENT,DOSP,Oahu,3.35004689,State Monument, , , , , ,Royal Mausoleum State Monument,Mauna ‘Ala - Royal Mausoleum State Monument,OA_SM_03,13557.1587799492,576.246112702833
308,fr,LIHUE-KOLOA FOREST RESERVE,DOFAW,Kauai,1787.74597108,Forest Reserve,https://dlnr.hawaii.gov/forestry/frs/reserves/kauai/lihue-koloa/,https://dlnr.hawaii.gov/dofaw/files/2013/09/HARChapter13-104.pdf, , ,https://dlnr.hawaii.gov/dofaw/files/2013/09/HAR-123-Game-Mammals.pdf,Lihue-Koloa Forest Reserve,Līhu‘e-Kōloa Forest Reserve,KA_FR_04,7234751.26468366,20989.3202929919
309,ws,ALPINE WILDLIFE SANCTUARY,DOFAW,Maui,298.68579731,Wildlife Sanctuary, ,https://files.hawaii.gov/dlnr/dofaw/rules/Chap125a.pdf,https://files.hawaii.gov/dlnr/dofaw/rules/Chap126.pdf, , ,Alpine Wildlife Sanctuary (Pending),Alpine Wildlife Sanctuary,MA_WS_13,1208738.53710249,7184.40942983957
310,ws,HAMAKUA MARSH WILDLIFE SANCTUARY (PUU O EHU),DOFAW,Oahu,68.42371295,Wildlife Sanctuary,https://dlnr.hawaii.gov/wildlife/sanctuaries/hamakua/,https://files.hawaii.gov/dlnr/dofaw/rules/Chap125a.pdf,https://files.hawaii.gov/dlnr/dofaw/rules/Chap126.pdf, , ,Hamakua Marsh Wildlife Sanctuary (Puu O Ehu),Hāmākua Marsh Wildlife Sanctuary (Pu‘u O Ehu),OA_WS_02,276900.942206612,3086.49936473852
311,ws,HAMAKUA MARSH WILDLIFE SANCTUARY,DOFAW,Oahu,22.59184225,Wildlife Sanctuary,https://dlnr.hawaii.gov/wildlife/sanctuaries/hamakua/,https://files.hawaii.gov/dlnr/dofaw/rules/Chap125a.pdf,https://files.hawaii.gov/dlnr/dofaw/rules/Chap126.pdf, , ,Hamakua Marsh Wildlife Sanctuary,Hāmākua Marsh Wildlife Sanctuary,OA_WS_01,91425.9419157632,2258.26244153185
312,nwr,HAKALAU FOREST NATIONAL WILDLIFE REFUGE S.KONA SEC,USFWS,Hawaii,16069.7485275,National Wildlife Refuge, , , , , ,Hakalau Forest National Wildlife Refuge S.Kona Sec,Hakalau Forest National Wildlife Refuge (South Kona Sec.),HA_NWR_02,65031965.0349649,71234.611412634
313,sp,KEEHI LAGOON MEMORIAL STATE PARK,Keehi Memorial Org./DOSP,Oahu,10.85539409,State Park, , , , , ,Keehi Lagoon Memorial State Park,Ke‘ehi Lagoon Memorial State Park,OA_SP_07,43930.2212937297,913.2772979006
314,fr-sm,WAIMANALO FR / MT OLOMANA STATE MONUMENT,DOFAW,Oahu,2.30650924,Forest Reserve/State Monument,https://dlnr.hawaii.gov/forestry/frs/reserves/oahu/,https://dlnr.hawaii.gov/dofaw/files/2013/09/HARChapter13-104.pdf, , , ,Waimanalo Fr / Mt Olomana State Monument,Waimānalo Forest Reserve,OA_FR-SM_01,9334.11173219556,423.109932683238
315,fr,WAIMANALO FOREST RESERVE,DOFAW,Oahu,1687.64053607,Forest Reserve,https://dlnr.hawaii.gov/forestry/frs/reserves/oahu/,https://dlnr.hawaii.gov/dofaw/files/2013/09/HARChapter13-104.pdf, , , ,Waimanalo Forest Reserve,Waimānalo Forest Reserve,OA_FR_21,6829638.94207818,21316.4906985814
316,fr,WAIMANALO FOREST RESERVE,DOFAW,Oahu,484.737162,Forest Reserve,https://dlnr.hawaii.gov/forestry/frs/reserves/oahu/,https://dlnr.hawaii.gov/dofaw/files/2013/09/HARChapter13-104.pdf, , , ,Waimanalo Forest Reserve,Waimānalo Forest Reserve,OA_FR_21,1961661.69723248,11180.7476390772
317,fr,MOLOKAI FOREST RESERVE,DOFAW,Molokai,732.24432898,Forest Reserve,https://dlnr.hawaii.gov/forestry/frs/reserves/maui-nui/molokai/,https://dlnr.hawaii.gov/dofaw/files/2013/09/HARChapter13-104.pdf, , , ,Molokai Forest Reserve,Moloka‘i Forest Reserve,MO_FR_01,2963287.66550785,13272.8838745114
318,ws,PUAAHALA WILDLIFE SANCTUARY,DOFAW,Molokai,66.85375172,Wildlife Sanctuary, , , , , ,Puaahala Wildlife Sanctuary,Pua‘ahala Wildlife Sanctuary,MO_WS_07,270547.534529563,2921.68412308045
319,r,KAHOOLAWE ISLAND RESERVE,KIRC,Kahoolawe,28549.3833612,Reserve, , , , , ,Kahoolawe Island Reserve,Kaho‘olawe Island Reserve,KH_R_01,115535255.410924,69410.3117032376
320,nwr,KILAUEA POINT NATIONAL WILDLIFE REFUGE,USFWS,Kauai,177.36210266,National Wildlife Refuge, , , , , ,Kilauea Point National Wildlife Refuge,Kīlauea Point National Wildlife Refuge,KA_NWR_03,717758.964246022,8333.15794818961
321,nwr,HANALEI NATIONAL WILDLIFE REFUGE,USFWS,Kauai,918.25327234,National Wildlife Refuge, , , , , ,Hanalei National Wildlife Refuge,Hanalei National Wildlife Refuge,KA_NWR_01,3716039.15256772,19017.3166191609
322,nwr,HULEIA NATIONAL WILDLIFE REFUGE,USFWS,Kauai,239.58042362,National Wildlife Refuge, , , , , ,Huleia National Wildlife Refuge,Hulē‘ia National Wildlife Refuge,KA_NWR_02,969547.575990184,9384.0843755033
323,nwr,JAMES CAMPBELL NATIONAL WILDLIFE REFUGE,USFWS,Oahu,1070.0783894,National Wildlife Refuge, , , , , ,James Campbell National Wildlife Refuge,James Campbell National Wildlife Refuge,OA_NWR_01,4330453.60260628,12074.7604305781
324,nwr,OAHU FOREST NATIONAL WILDLIFE REFUGE,USFWS,Oahu,4592.05880595,National Wildlife Refuge, , , , , ,Oahu Forest National Wildlife Refuge,O‘ahu Forest National Wildlife Refuge,OA_NWR_02,18583402.6708822,18904.6283454113
325,nwr,PEARL HARBOR NAT'L WILDLIFE REFUGE (KALAELOA),USFWS,Oahu,37.87710898,National Wildlife Refuge, , , , , ,Pearl Harbor Nat'L Wildlife Refuge (Kalaeloa),Pearl Harbor National Wildlife Refuge (Kalaeloa),OA_NWR_03,153283.221735878,1761.32029544696
326,nwr,PEARL HARBOR NATIONAL WILDLIFE REFUGE (HONOULIULI),USFWS,Oahu,36.84704191,National Wildlife Refuge, , , , , ,Pearl Harbor National Wildlife Refuge (Honouliuli),Pearl Harbor National Wildlife Refuge (Honouliuli),OA_NWR_05,149114.688196102,1836.50217727684
327,nwr,PEARL HARBOR NATIONAL WILDLIFE REFUGE (WAIAWA),USFWS,Oahu,27.61705074,National Wildlife Refuge, , , , , ,Pearl Harbor National Wildlife Refuge (Waiawa),Pearl Harbor National Wildlife Refuge (Waiawa),OA_NWR_04,111762.23916037,1462.00195902607
328,nwr,PEARL HARBOR NATIONAL WILDLIFE REFUGE,USFWS,Oahu,11.59080786,National Wildlife Refuge, , , , , ,Pearl Harbor National Wildlife Refuge,Pearl Harbor National Wildlife Refuge,OA_NWR_06,46906.3352304003,1156.75936810769
329,nwr,KAKAHAIA NATIONAL WILDLIFE REFUGE,USFWS,Molokai,44.63083578,National Wildlife Refuge, , , , , ,Kakahaia National Wildlife Refuge,Kakahai‘a National Wildlife Refuge,MO_NWR_01,180614.58442602,2717.93238032297
330,nwr,KEALIA POND NATIONAL WILDLIFE REFUGE,USFWS,Maui,704.32245637,National Wildlife Refuge, , , , , ,Kealia Pond National Wildlife Refuge,Keālia Pond National Wildlife Refuge,MA_NWR_01,2850291.85601332,11914.4165896503
331,nhs,PUUKOHOLA HEIAU NATIONAL HISTORIC SITE,USNPS,Hawaii,86.27276885,National Historic Site, , , , , ,Puukohola Heiau National Historic Site,Pu‘ukoholā Heiau National Historic Site,HA_NHS_01,349133.508704978,2829.0156883418
332,nhp,KALOKO-HONOKOHAU NATIONAL HISTORICAL PARK,USNPS,Hawaii,1254.42027906,National Historical Park, , , , , ,Kaloko-Honokohau National Historical Park,Kaloko-Honokōhau National Historical Park,HA_NHP_09,5076458.76268663,11480.6628462878
333,np,HAWAII VOLCANOES NATIONAL PARK,USNPS,Hawaii,379701.051746,National Park, , , , , ,Hawaii Volcanoes National Park,Hawai‘i Volcanoes National Park,HA_NP_01,1536595639.84968,381733.596398421
334,nhp,PUU HONAU O HONAUNAU NATIONAL HISTORICAL PARK,USNPS,Hawaii,422.27343948,National Historical Park, , , , , ,Puu Honau O Honaunau National Historical Park,Pu‘uhonua O Hōnaunau National Historical Park,HA_NHP_10,1708879.98056372,15289.5929059495
335,nm,PEARL HARBOR NATIONAL MEMORIAL,USNPS,Oahu,21.73208693,National Memorial, , , , , ,Pearl Harbor National Memorial,Pearl Harbor National Memorial,OA_NM_01,87946.6355822303,3273.47021490575
336,fr,EWA FOREST RESERVE (HELEMANO SEC.),DOFAW,Oahu,2770.30469319,Forest Reserve,https://dlnr.hawaii.gov/forestry/frs/reserves/oahu/,https://dlnr.hawaii.gov/dofaw/files/2013/09/HARChapter13-104.pdf, , , ,Ewa Forest Reserve (Helemano Sec.),‘Ewa Forest Reserve (Helemano Section),OA_FR_22,11211025.3396283,33405.9133437843
337,fr,PUPUKEA-PAUMALU FOREST RESERVE,DOFAW,Oahu,3746.60187016,Forest Reserve,https://dlnr.hawaii.gov/forestry/frs/reserves/oahu/pupukea-forest-reserve/,https://dlnr.hawaii.gov/dofaw/files/2013/09/HARChapter13-104.pdf, , , ,Pupukea-Paumalu Forest Reserve,Pūpūkea-Paumalū Forest Reserve,OA_FR_23,15161959.8404493,20761.4240778352
